{
  "protocol": "1.0",
  "requestId": "019907e7-743e-7f30-9c5f-bc041afe5a21",
  "sequence": 1842,
  "timestampUtc": "2026-08-20T18:14:03.219Z",
  "frequencyHz": 92300000,
  "centerFrequencyHz": 92100000,
  "detector": "WFM",
  "filterBandwidthHz": 180000,
  "receiver": {
    "listeningPointId": "019907e3-ea01-7f30-9c5f-bc041afe5a21",
    "receiverProfileId": "019907e4-9201-7f30-9c5f-bc041afe5a21"
  },
  "rds": {
    "pi": "9401",
    "ps": "BAND_FM"
  },
  "limit": 20
}

